{
  "$schema": "http://json-schema.org/draft-07/schema#",
  "$id": "https://mcpf.dev/schemas/mcp-server-credential-v1.json",
  "title": "MCP Server Credential",
  "description": "Verifiable Credential for MCP server registration and capabilities",
  "type": "object",
  "required": [
    "@context",
    "type",
    "issuer",
    "issuanceDate",
    "credentialSubject",
    "proof"
  ],
  "properties": {
    "@context": {
      "type": "array",
      "items": {
        "type": "string"
      },
      "minItems": 2,
      "contains": {
        "const": "https://www.w3.org/2018/credentials/v1"
      }
    },
    "type": {
      "type": "array",
      "items": {
        "type": "string"
      },
      "contains": {
        "enum": ["VerifiableCredential", "MCPServerCredential"]
      }
    },
    "issuer": {
      "type": "string",
      "pattern": "^did:"
    },
    "issuanceDate": {
      "type": "string",
      "format": "date-time"
    },
    "expirationDate": {
      "type": "string",
      "format": "date-time"
    },
    "credentialSubject": {
      "type": "object",
      "required": [
        "id",
        "serverId",
        "name",
        "operator",
        "capabilities",
        "endpoint"
      ],
      "properties": {
        "id": {
          "type": "string",
          "pattern": "^did:",
          "description": "DID of the MCP server"
        },
        "serverId": {
          "type": "string",
          "pattern": "^[a-z0-9-]+$",
          "description": "Unique identifier for the server"
        },
        "name": {
          "type": "string",
          "minLength": 3,
          "maxLength": 100
        },
        "operator": {
          "type": "string",
          "minLength": 2
        },
        "operatorDid": {
          "type": "string",
          "pattern": "^did:"
        },
        "capabilities": {
          "type": "array",
          "items": {
            "type": "object",
            "required": ["name", "scope"],
            "properties": {
              "name": {"type": "string"},
              "description": {"type": "string"},
              "scope": {
                "type": "string",
                "enum": ["read", "write", "execute", "admin"]
              },
              "dataAccess": {
                "type": "string",
                "enum": ["public", "internal", "confidential", "restricted"]
              }
            }
          },
          "minItems": 1
        },
        "dataClassification": {
          "type": "string",
          "enum": ["public", "internal", "confidential", "restricted"]
        },
        "endpoint": {
          "type": "string",
          "format": "uri",
          "pattern": "^https://"
        },
        "compliance": {
          "type": "array",
          "items": {"type": "string"}
        }
      }
    },
    "credentialStatus": {
      "type": "object",
      "required": [
        "id",
        "type",
        "statusPurpose",
        "statusListIndex",
        "statusListCredential"
      ],
      "properties": {
        "id": {"type": "string", "format": "uri"},
        "type": {"type": "string", "const": "StatusList2021Entry"},
        "statusPurpose": {
          "type": "string",
          "enum": ["revocation", "suspension"]
        },
        "statusListIndex": {"type": "string", "pattern": "^[0-9]+$"},
        "statusListCredential": {"type": "string", "format": "uri"}
      }
    },
    "proof": {
      "type": "object",
      "required": [
        "type",
        "created",
        "verificationMethod",
        "proofPurpose",
        "proofValue"
      ],
      "properties": {
        "type": {
          "type": "string",
          "enum": ["Ed25519Signature2020", "EcdsaSecp256k1Signature2019"]
        },
        "created": {"type": "string", "format": "date-time"},
        "verificationMethod": {"type": "string", "pattern": "^did:"},
        "proofPurpose": {
          "type": "string",
          "enum": ["assertionMethod", "authentication"]
        },
        "proofValue": {"type": "string"}
      }
    }
  }
}
