{
  "@context": [
    "https://www.w3.org/2018/credentials/v1",
    "https://mcpf.dev/schemas/v1"
  ],
  "type": [
    "VerifiableCredential",
    "MCPServerCredential"
  ],
  "issuer": "did:web:trust-anchor.example",
  "issuanceDate": "2025-12-30T00:00:00Z",
  "expirationDate": "2026-12-30T00:00:00Z",
  "credentialSubject": {
    "id": "did:web:weather.example.com:mcp:api",
    "serverId": "weather-api",
    "name": "National Weather Service API",
    "operator": "National Weather Service",
    "capabilities": [
      {
        "name": "getCurrentWeather",
        "scope": "read",
        "dataAccess": "public"
      },
      {
        "name": "getForecast",
        "scope": "read",
        "dataAccess": "public"
      }
    ],
    "dataClassification": "public",
    "endpoint": "https://weather.example.com/mcp",
    "compliance": [
      "ISO-27001",
      "Data-Protection-Act"
    ],
    "securityAudit": {
      "date": "2025-12-01",
      "status": "passed",
      "auditor": "Independent Security Firm"
    }
  },
  "credentialStatus": {
    "id": "https://trust-anchor.example/status/mcp/1#42",
    "type": "StatusList2021Entry",
    "statusPurpose": "revocation",
    "statusListIndex": "42",
    "statusListCredential": "https://trust-anchor.example/status/mcp/1"
  },
  "proof": {
    "type": "Ed25519Signature2020",
    "created": "2025-12-30T00:00:00Z",
    "verificationMethod": "did:web:trust-anchor.example#key-1",
    "proofPurpose": "assertionMethod",
    "proofValue": "z58DAdFfa9SkqZMVPxGoraebniAg3yozTTWgFnTSqKyJuYtdMj1SEuWWfeFi8KZHNKvMPy9dDQsYZnTBHUMhLwYrK"
  }
}
